{
  "$schema": "./schemas/package.schema.json",
  "name": "template-management-cli",
  "template": "docker-image-aws",
  "templateVersion": "0.1.0",
  "configuration": {
    "imageTag": "template-management-cli"
  },
  "deployments": [
    {
      "name": "dev",
      "awsRegion": "us-west-2",
      "awsUser": "goldstack-dev",
      "configuration": {
        "repositoryName": "template-management-cli"
      },
      "tfStateKey": "template-management-cli-dev-28b04fbe80dac501a702.tfstate"
    },
    {
      "name": "prod",
      "awsRegion": "us-west-2",
      "awsUser": "goldstack-prod",
      "configuration": {
        "repositoryName": "template-management-cli"
      },
      "tfStateKey": "template-management-cli-prod-7e6a9b6547b360477d57.tfstate"
    }
  ]
}
