{
  "$schema": "./schemas/package.schema.json",
  "name": "session-bucket",
  "template": "s3",
  "templateVersion": "0.1.0",
  "configuration": {},
  "deployments": [
    {
      "name": "dev",
      "awsRegion": "us-west-2",
      "awsUser": "goldstack-dev",
      "configuration": {
        "bucketName": "goldstack-sessions-dev"
      },
      "tfStateKey": "session-bucket-dev-5e7438e9af4048c1b9d2.tfstate"
    },
    {
      "name": "prod",
      "awsRegion": "us-west-2",
      "awsUser": "goldstack-prod",
      "configuration": {
        "bucketName": "goldstack-sessions-prod"
      },
      "tfStateKey": "session-bucket-prod-43b7d80d2ca7d9441533.tfstate"
    }
  ]
}
