{
  "$schema": "./schemas/package.schema.json",
  "name": "lambda-api-template",
  "template": "lambda-api",
  "templateVersion": "0.1.0",
  "configuration": {},
  "deployments": [
    {
      "name": "prod",
      "awsRegion": "us-west-2",
      "awsUser": "goldstack-dev",
      "configuration": {
        "lambdaNamePrefix": "goldstack-test-lambda-api-v2",
        "apiDomain": "lambda-api-v2.examples.templates.dev.goldstack.party",
        "hostedZoneDomain": "dev.goldstack.party",
        "cors": "https://app-nextjs-bootstrap.templates.dev.goldstack.party",
        "lambdas": {
          "default": {
            "function_name": "goldstack-test-lambda-api-v2-__default",
            "route": "$default"
          },
          "ANY /admin/{proxy+}": {
            "function_name": "goldstack-test-lambda-api-v2-admin-_proxy__",
            "route": "ANY /admin/{proxy+}"
          },
          "ANY /cart/{sessionId}/items": {
            "function_name": "goldstack-test-lambda-api-v2-cart-_sessionId_-items",
            "route": "ANY /cart/{sessionId}/items"
          },
          "ANY /echo": {
            "function_name": "goldstack-test-lambda-api-v2-echo",
            "route": "ANY /echo"
          },
          "ANY /order/{id}": {
            "function_name": "goldstack-test-lambda-api-v2-order-_id_",
            "route": "ANY /order/{id}"
          },
          "ANY /user": {
            "function_name": "goldstack-test-lambda-api-v2-user-index-__index",
            "route": "ANY /user"
          },
          "ANY /user/{userId}": {
            "function_name": "goldstack-test-lambda-api-v2-user-_userId_",
            "route": "ANY /user/{userId}"
          }
        }
      },
      "tfStateKey": "lambda-api-template-prod-9d3d0e0a2d6a51e5308a.tfstate",
      "tfVersion": "1.7"
    }
  ]
}
