{
  "$schema": "./schemas/package.schema.json",
  "name": "docker-image-aws-template",
  "template": "docker-image-aws",
  "templateVersion": "0.1.0",
  "configuration": {
    "imageTag": "my-test-image"
  },
  "deployments": [
    {
      "name": "prod",
      "awsRegion": "us-west-2",
      "awsUser": "goldstack-dev",
      "configuration": {
        "repositoryName": "docker-image-aws-template-repo-v2"
      },
      "tfStateKey": "docker-image-aws-template-prod-0dcb9f77687a3870cc13.tfstate"
    }
  ]
}