{
  "$schema": "./schemas/package.schema.json",
  "name": "project-package-bucket",
  "template": "s3",
  "templateVersion": "0.1.0",
  "configuration": {},
  "deployments": [
    {
      "name": "dev",
      "awsRegion": "us-west-2",
      "awsUser": "goldstack-dev",
      "configuration": {
        "bucketName": "goldstack-packages-dev"
      },
      "tfStateKey": "project-package-bucket-dev-491992ac68b98390ebf5.tfstate"
    },
    {
      "name": "prod",
      "awsRegion": "us-west-2",
      "awsUser": "goldstack-prod",
      "configuration": {
        "bucketName": "goldstack-packages-prod"
      },
      "tfStateKey": "project-package-bucket-prod-08da8f2d92e0de8a3f5e.tfstate"
    }
  ]
}
