{
  "$schema": "./schemas/package.schema.json",
  "name": "project-repository-bucket",
  "template": "s3",
  "templateVersion": "0.1.0",
  "configuration": {},
  "deployments": [
    {
      "name": "dev",
      "awsRegion": "us-west-2",
      "awsUser": "goldstack-dev",
      "configuration": {
        "bucketName": "goldstack-projects-dev"
      },
      "tfStateKey": "project-repository-bucket-dev-faac73d5029a51b9a1b2.tfstate"
    },
    {
      "name": "prod",
      "awsRegion": "us-west-2",
      "awsUser": "goldstack-prod",
      "configuration": {
        "bucketName": "goldstack-projects-prod"
      },
      "tfStateKey": "project-repository-bucket-prod-ca2ce68e07f64423df85.tfstate"
    }
  ]
}
