{
  "$schema": "./schemas/package.schema.json",
  "name": "user-management",
  "template": "user-management",
  "templateVersion": "0.1.0",
  "configuration": {},
  "deployments": [
    {
      "name": "prod",
      "awsRegion": "us-west-2",
      "awsUser": "goldstack-dev",
      "configuration": {
        "cognitoDomain": "auth-example-v2.dev.goldstack.party",
        "userPoolName": "example-pool-v2",
        "cookieDomain": ".dev.goldstack.party",
        "cookieSameSite": "None",
        "hostedZoneDomain": "dev.goldstack.party",
        "callbackUrl": "https://ssr.examples.templates.dev.goldstack.party",
        "deletionProtection": false
      },
      "tfStateKey": "user-management-prod-c24c67342f629ac2217b.tfstate",
      "tfVersion": "1.14.7"
    }
  ]
}
