{
  "$schema": "./schemas/package.schema.json",
  "name": "lambda-go-gin-template",
  "template": "lambda-go-gin",
  "templateVersion": "0.1.0",
  "configuration": {},
  "deployments": [
    {
      "name": "prod",
      "awsRegion": "us-west-2",
      "awsUser": "goldstack-dev",
      "configuration": {
        "lambdaName": "goldstack-test-lambda-go-gin",
        "apiDomain": "go-gin-api.templates.dev.goldstack.party",
        "hostedZoneDomain": "dev.goldstack.party",
        "cors": "https://app-nextjs-bootstrap.templates.dev.goldstack.party"
      },
      "tfStateKey": "lambda-go-gin-template-prod-e346f6ec1a6c006baaa0.tfstate",
      "tfVersion": "1.14.7"
    }
  ]
}
