{
  "$schema": "./schemas/package.schema.json",
  "name": "lambda-python-job",
  "template": "lambda-python-job",
  "templateVersion": "0.1.0",
  "configuration": {},
  "deployments": [
    {
      "name": "prod",
      "awsRegion": "us-west-2",
      "awsUser": "goldstack-dev",
      "configuration": {
        "lambdaName": "lambda-python-job-test",
        "schedule": "rate(1 minute)",
        "sqsQueueName": "lambda-python-job-sqs-test"
      },
      "tfVersion": "1.14.7",
      "tfStateKey": "lambda-python-job-prod-279b0e980347eb11b01d.tfstate"
    }
  ]
}
