{
  "$schema": "./schemas/package.schema.json",
  "name": "lambda-node-trigger",
  "template": "lambda-node-trigger",
  "templateVersion": "0.1.0",
  "configuration": {},
  "deployments": [
    {
      "name": "prod",
      "awsRegion": "us-west-2",
      "awsUser": "goldstack-dev",
      "configuration": {
        "lambdaName": "lambda-node-trigger-test",
        "schedule": "rate(1 day)",
        "sqsQueueName": "lambda-node-trigger-sqs-test"
      },
      "tfVersion": "1.14.7",
      "tfStateKey": "lambda-node-trigger-prod-5001cd04b339e4a7da56.tfstate"
    }
  ]
}
