{
  "$schema": "./schemas/package.schema.json",
  "name": "s3",
  "template": "s3",
  "templateVersion": "0.1.0",
  "configuration": {},
  "deployments": [
    {
      "name": "prod",
      "awsRegion": "us-west-2",
      "awsUser": "goldstack-dev",
      "configuration": {
        "bucketName": "goldstack-test-s3-bucket"
      },
      "tfStateKey": "s3-prod-40dd578eab44b83dc601.tfstate",
      "tfVersion": "1.14.7"
    }
  ]
}
