{
  "$schema": "./schemas/package.schema.json",
  "name": "server-side-rendering",
  "template": "server-side-rendering",
  "templateVersion": "0.1.0",
  "configuration": {},
  "deployments": [
    {
      "name": "prod",
      "awsRegion": "us-west-2",
      "awsUser": "goldstack-dev",
      "configuration": {
        "lambdaNamePrefix": "goldstack-test-ssr-v2",
        "domain": "ssr-v2.examples.templates.dev.goldstack.party",
        "hostedZoneDomain": "dev.goldstack.party",
        "cors": "https://app-nextjs-bootstrap.templates.dev.goldstack.party",
        "lambdas": {
          "ANY /": {
            "function_name": "goldstack-test-ssr-v2-__index",
            "route": "ANY /"
          },
          "ANY /posts": {
            "function_name": "goldstack-test-ssr-v2-posts",
            "route": "ANY /posts"
          },
          "ANY /robots.txt": {
            "function_name": "goldstack-test-ssr-v2-robots_txt",
            "route": "ANY /robots.txt"
          }
        }
      },
      "tfStateKey": "server-side-rendering-prod-cef430073a2474be1434.tfstate",
      "tfVersion": "1.14.7"
    }
  ]
}
