{
  "$schema": "./schemas/package.schema.json",
  "name": "email-send",
  "template": "email-send",
  "templateVersion": "0.1.0",
  "configuration": {},
  "deployments": [
    {
      "name": "prod",
      "awsRegion": "us-west-2",
      "awsUser": "goldstack-dev",
      "configuration": {
        "domain": "email-send-v2.templates.dev.goldstack.party",
        "hostedZoneDomain": "dev.goldstack.party"
      },
      "tfStateKey": "email-send-prod-c1356c7f30852453a420.tfstate",
      "tfVersion": "1.14.7"
    }
  ]
}
